title,links,date,rating,quality,genre,short_description
Sổ Tay Chăm Con Của Ông Bố Bỉm Sữa,https://ohitv.net/phim-bo/so-tay-cham-con-cua-ong-bo-bim-sua/,11/04/2024,0,,['Phim Chính Kịch'],"Sáu năm trước, An Nhiên phải đối mặt với hàng loạt bi kịch, bắt đầu từ việc mẹ cô qua đời trong một vụ tai nạn ô tô đau lòng. Đồng thời, cô cũng ..."
Loài Thống Trị,https://ohitv.net/phim-bo/blood-free/,10/04/2024,0,,"['Phim Chính Kịch', 'Sci-Fi & Fantasy']","Kết thúc hàng triệu năm của việc con người ăn thịt động vật, BF hiện nay thống trị thị trường thịt nuôi cấy được kỹ thuật sinh học. Có những ..."
Cõng Anh Mà Chạy,https://ohitv.net/phim-bo/lovely-runner/,08/04/2024,0,,"['Phim Chính Kịch', 'Phim Hài', 'Sci-Fi & Fantasy']","Trong thế giới lấp lánh của ngôi sao, Ryu Seon Jae tỏa sáng như một người nổi tiếng hàng đầu, thu hút ánh sáng chiếu sáng kể từ khi ra mắt. Mặc ..."
Ký sinh thú: Vùng xám,https://ohitv.net/phim-bo/ky-sinh-thu-vung-xam/,05/04/2024,10,,"['Phim Chính Kịch', 'Sci-Fi & Fantasy']",Câu chuyện mô tả về những kẻ ký sinh từ không gian rơi xuống Trái Đất và bắt đầu giết người để lấy sức mạnh của riêng họ bằng cách kiểm soát não ...
Rebel Moon – Phần hai: Kẻ khắc vết sẹo,https://ohitv.net/phim-le/rebel-moon-phan-hai-ke-khac-vet-seo/,05/04/2024,6, 1080p,"['Phim Chính Kịch', 'Phim Hành Động', 'Phim Khoa Học Viễn Tưởng']","Trong “Rebel Moon – Phần hai: Kẻ Khắc Vết Sẹo,” quân kháng chiến đã sẵn sàng đối mặt với các thế lực đang đe dọa Thế Giới Mẹ. ..."
Hạo Y Hành,https://ohitv.net/phim-bo/hao-y-hanh/, ,0,,"['Phim Bí Ẩn', 'Phim Chính Kịch']","Câu chuyện lấy bối cảnh trong một thời kỳ hỗn loạn, nơi thế giới đang phải đối mặt với một cuộc xâm lược có thể xảy ra của thế giới quỷ do một ..."
Yêu Giữa Đất Trời Đảo Điên,https://ohitv.net/phim-bo/yeu-giua-dat-troi-dao-dien/,02/04/2024,0,,"['Phim Chính Kịch', 'Phim Hình Sự']","Tại một quán bar sôi động, Sen từ Tập đoàn Kuntai gặp gỡ Ling Yi, một cô gái phục vụ, mở đầu cho một chuỗi sự kiện sẽ thay đổi cuộc đời của cả ..."
Ly Ca,https://ohitv.net/phim-bo/ly-ca/,31/03/2024,0,,"['Phim Bí Ẩn', 'Phim Chính Kịch']","Khi Mã Trác 8 tuổi, cô được mẹ Trần Quả Quả đưa đến sống ở Lâm Giang, nơi cô gặp anh trai hàng xóm Hạ Trạch. Dần dần, qua những khoảnh khắc vui ..."
Hồng Y Túy,https://ohitv.net/phim-bo/quoc-sac-phuong-hoa/, ,0,,"['Action & Adventure', 'Phim Chính Kịch']","Đặt trong thời kỳ Đường, câu chuyện kể về huyền thoại và nguồn cảm hứng của một người phụ nữ trồng hoa mành và cuối cùng đã giúp đỡ nhân dân thế ..."
Tình Yêu Có Pháo Hoa,https://ohitv.net/phim-bo/dai-mong-quy-ly/, ,0,,"['Action & Adventure', 'Phim Chính Kịch']","Câu chuyện xoay quanh một con quỷ mạnh mẽ, mệt mỏi với sự tồn tại, từ chối nhường bước cho sự diệt vong, thay vào đó lựa chọn bắt đầu một hành ..."
Lưu Thuỷ Đào Đào,https://ohitv.net/phim-bo/niem-vo-song/, ,0,,"['Phim Chính Kịch', 'Sci-Fi & Fantasy']","Để lấy lại bảo vật của Thiên Đình, Nữ thần Vô Song hạ xuống trần gian để ám sát Nguyên Trung, vị cao thủ của Hội Yêu Hồ. Trong quá trình đó, Vô ..."
Chiết Yêu,https://ohitv.net/phim-bo/cam-nguyet-nhu-ca/, ,0,,['Phim Chính Kịch'],"Một tướng nữ với vẻ ngoài dịu dàng nhưng tinh thần mạnh mẽ bên trong, và một tướng nam có vẻ ngoài lạnh lùng nhưng bên trong lại mạnh mẽ hơn về ..."
Tử Dạ Quy,https://ohitv.net/phim-bo/rem-ngoc-chau-sa/, ,0,,['Phim Chính Kịch'],"Duan Wu, một nô lệ tại một trang trại trồng ngọc trai, quyết tâm thay đổi số phận của mình, vì vậy cô ta trốn thoát và gặp gỡ Yan Zi Jing, một ..."
Niệm Vô Song,https://ohitv.net/phim-bo/tung-buoc-yeu-thuong/,28/03/2024,0,,['Phim Chính Kịch'],"Câu chuyện kể về nhà thiết kế không gian Bộ Nhiễm, người trong một lần tình cờ gặp gỡ với ông chủ Lộ Sâm Dương, cũng có khả năng thiết kế. Dù cả ..."
Cẩm Nguyệt Như Ca,https://ohitv.net/phim-bo/chuong-quy-ca-ca-mau-di-di/,28/03/2024,0,,['Phim Chính Kịch'],"Dư Tịch Tịch và Dư Triều, dù lớn lên dưới cùng một mái nhà, nhưng tính cách của họ lại hoàn toàn khác nhau. Dư Triều là người ít nói, nghiêm túc ..."
Rèm Ngọc Châu Sa,https://ohitv.net/phim-bo/thu-bac/,07/06/2024,0,,['Phim Chính Kịch'],"0,01% số học sinh đứng đầu nắm quyền kiểm soát luật pháp và trật tự ở trường cấp ba Jusin, nhưng một học sinh chuyển trường bí mật lại gây nhiễu ..."
Thừa Hoan Ký,https://ohitv.net/phim-le/anh-hung-ban-phim/,27/03/2024,0,,"['Phim Chiếu Rạp', 'Phim Chính Kịch', 'Phim Hình Sự']","Im Sang-jin, một phóng viên mảng xã hội, bị đình chỉ công tác sau khi bài phóng sự điều tra về tập đoàn Manjun bị đánh giá là sai lệch. Tưởng ..."
Các Cô Ấy Của Hôm Nay,https://ohitv.net/phim-bo/mat-tich/,23/03/2024,0,,"['Phim Bí Ẩn', 'Phim Chính Kịch']","“Mất Tích” là câu chuyện về Na Moon Young (do Lee Bo Young thủ vai), trong cuộc hành trình tìm kiếm người chồng mất tích của mình, ..."
Từng Bước Yêu Thương (Bộ Bộ Khuynh Tâm),https://ohitv.net/phim-bo/ve-dep-thuan-khiet/,23/03/2024,0,,"['Phim Chính Kịch', 'Phim Gia Đình']","Park Do Ra là một người phụ nữ sáng sủa, dũng cảm và có tính cách thách thức, đã trở thành một nữ diễn viên hàng đầu vì mẹ cô, Baek Mi Ja, nói ..."
Chưởng Quỹ Ca Ca Mau Đi Đi,https://ohitv.net/phim-bo/uyen-uyen-nhu-mong-tieu/,21/03/2024,0,,['Phim Chính Kịch'],"Ling Xiao đã giữ thái độ thấp thỏm trong nhiều năm để cuối cùng đạt được quyền lực và trở thành chủ thành phố mạnh mẽ mới. Để trả thù, anh buộc ..."
Thứ Bậc,https://ohitv.net/phim-bo/chap-but/,20/03/2024,10,,['Phim Chính Kịch'],"Tô Vân Khởi, đích nữ của Tướng phủ, vô tình phát hiện mình là “bia đỡ đạn” trong “Sách Mệnh” và không có cách nào có thể ..."
Mất Tích,https://ohitv.net/phim-bo/sac-xuan-gui-nguoi-tinh/, ,0,,['Phim Chính Kịch'],"Chen Mai Dong và Zhuang Jie, mỗi người một số phận, đều đã trải qua những biến cố đau lòng trong cuộc sống. Chen Mai Dong, từng là một thanh niên ..."
Vẻ Đẹp Thuần Khiết,https://ohitv.net/phim-bo/chuyen-bay-khong-co-khieu-nai/,18/03/2024,0,,['Phim Chính Kịch'],
Uyển Uyển Như Mộng Tiêu,https://ohitv.net/phim-bo/du-phuong-hanh/,18/03/2024,0,,"['Phim Chính Kịch', 'Sci-Fi & Fantasy']","“Dữ Phượng Hành” là một bộ phim kể về mối tình giữa Thẩm Ly, nữ vương của Ma giới, và Hành Chỉ, vị Thần quân duy nhất còn sống trong ..."
Chấp Bút,https://ohitv.net/phim-bo/ho-yeu-tieu-hong-nuong-nguyet-hong-thien/, ,0,,"['Action & Adventure', 'Phim Chính Kịch', 'Sci-Fi & Fantasy']",“Hồ Yêu Tiểu Hồng Nương: Nguyệt Hồng Thiên” là một bộ phim cổ tích cổ điển có sự tham gia của diễn viên Dương Mịch. Bộ phim kể về câu ...
Sắc Xuân Gửi Người Tình,https://ohitv.net/phim-bo/tam-biet-bach-nguyet-quang/,15/03/2024,0,,['Phim Chính Kịch'],"Trong câu chuyện này, trước đám cưới 6 năm trước, Chu Miên bị phản bội và rơi xuống biển. May mắn thay, cô được Mạch Khác cứu sống và từ đó cô đã ..."
Chuyến Bay Không Có Khiếu Nại,https://ohitv.net/phim-le/co-ay-ruc-ro/,15/03/2024,0,,"['Phim Chiếu Rạp', 'Phim Chính Kịch', 'Phim Gia Đình']","Một người phụ nữ lương thiện và tử tế đột ngột gặp lại cháu gái đã mất tích cách đây 12 năm trong một tai nạn khó lường. Ban đầu, họ chỉ là những ..."
Dữ Phượng Hành,https://ohitv.net/phim-bo/nguoi-yeu-thu-cung-cua-toi/,14/03/2024,6.7,,['Phim Chính Kịch'],"Câu chuyện kể về một cô gái xinh đẹp bỗng dưng biến thành một chú heo nhỏ sau một đêm. Vì bạn trai không thích heo xinh, nên Chu Châu quyết định ..."
Giấc Mơ Lọ Lem,https://ohitv.net/phim-bo/giac-mo-lo-lem/,31/05/2024,0,,['Phim Hài'],"Thường thì ghét của nào trời trao của ấy. Câu nói này luôn đúng, đặc biệt là trong trường hợp của đôi nam thanh nữ tú trong bộ phim Giấc Mơ Lọ ..."
Có Dám Yêu Anh,https://ohitv.net/phim-bo/co-dam-yeu-anh/,13/05/2024,0,,['Phim Hài'],"Shin Yoon Book, đến từ ngôi làng cổ kính Seongsan ở Hàn Quốc, là một người được giao phó nhiệm vụ bảo tồn di sản văn hóa từ thời Joseon. Dường ..."
Tai Nạn,https://ohitv.net/phim-bo/tai-nan/,13/05/2024,0,,"['Phim Hài', 'Phim Hình Sự']","Bộ phim tập trung vào đội điều tra về tội phạm giao thông, bao gồm Cha Yeon Ho, Min So Hee, và nhóm chuyên điều tra về các vụ án liên quan đến ..."
Mẹ Của Nàng Dâu,https://ohitv.net/phim-le/me-cua-nang-dau/,08/05/2024,4.6, 1080p,"['Phim Hài', 'Phim Lãng Mạn']","Mẹ Của Nàng Dâu Mother of the Bride 2024 là một bộ phim hài lãng mạn được mong đợi của năm 2024, do đạo diễn Mark Waters chỉ đạo. Phim kể về câu ..."
Xin Hãy Yêu Anh Như Vậy,https://ohitv.net/phim-bo/xin-hay-yeu-anh-nhu-vay/,03/05/2024,0,,"['Phim Chính Kịch', 'Phim Hài']",Xin hãy yêu anh như vậy” là một bộ phim truyền hình tình cảm đô thị do đạo diễn Trương Bác Dục (đạo diễn của “Khúc biến tấu ánh ...
Phát Thanh Viên Thành Thật,https://ohitv.net/phim-bo/phat-thanh-vien-thanh-that/,01/05/2024,0,,['Phim Hài'],Song Ki Baek độc thân và 33 tuổi. Anh làm việc làm người thông báo tại một đài truyền hình. Mọi người coi anh là một người thông báo lý tưởng. ...
Unfrosted: Câu chuyện Pop-Tart,https://ohitv.net/phim-le/unfrosted-cau-chuyen-pop-tart/,30/04/2024,5.6, 1080p,"['Phim Hài', 'Phim Lịch Sử']",“Unfrosted: Câu chuyện Pop-Tart” (2024) là một bộ phim tài liệu hấp dẫn khám phá sâu vào cuộc đua giữa các công ty thực phẩm lớn ...
City Hunter,https://ohitv.net/phim-le/city-hunter/,24/04/2024,0, 1080p,"['Phim Bí Ẩn', 'Phim Hài', 'Phim Lãng Mạn']","Phim “City Hunter” 2024 nói về thám tử tư Saeba Ryo, một tay súng bắn tỉa tài năng và cũng là một chàng trai hư hỏng, đồng ý hợp tác ..."
Sổ Tay Hướng Dẫn Yêu Đương Tiết Kiệm,https://ohitv.net/phim-bo/so-tay-huong-dan-yeu-duong-tiet-kiem/,14/04/2024,0,,['Phim Hài'],"“Sổ Tay Hướng Dẫn Yêu Đương Tiết Kiệm” là câu chuyện xoay quanh Giản Khả Khả (do Quách Thư Diệu thủ vai), một nhân viên văn phòng ..."
Không Có Chuyện Gì Mà Một Nồi Lẩu Không Giải Quyết Được,https://ohitv.net/phim-le/khong-co-chuyen-gi-ma-mot-noi-lau-khong-giai-quyet-duoc/,13/04/2024,6.4,,"['Phim Bí Ẩn', 'Phim Hài', 'Phim Hình Sự']",Bốn người không quen biết nhau chia sẻ số tiền trong kho hậu trường của nhà hát và tình cờ bị cuốn vào một vụ án mạng.
Thế Tử Biến Mất Rồi!,https://ohitv.net/phim-bo/missing-crown-prince/,13/04/2024,0,,['Phim Hài'],Một phiên bản hài lãng mạn của thời kỳ Joseon về một hoàng tử bị bắt cóc bởi một phụ nữ được đặt làm vợ của mình. Trong khi chạy trốn để giữ mạng ...
Bộ Lọc,https://ohitv.net/phim-bo/bo-loc/, ,0,,"['Phim Hài', 'Phim Lãng Mạn']","Một sản phẩm siêu công nghệ mang lại cho cô gái bình thường Su Cheng Cheng khả năng thay đổi diện mạo. Tang Qi, người có mối liên kết với Su ..."
Đoán Xem Tôi Là Ai,https://ohitv.net/phim-bo/doan-xem-toi-la-ai/,22/03/2024,0,,['Phim Hài'],"“Đoán Xem Tôi Là Ai” là một bộ phim truyền hình năm 2024 với câu chuyện xoay quanh nhân vật Tống Dao, một người phụ nữ có khả năng kỳ ..."
Gà nugget,https://ohitv.net/phim-bo/ga-nugget/,15/03/2024,0,,"['Phim Bí Ẩn', 'Phim Hài', 'Sci-Fi & Fantasy']","“Gà Nugget” là một bộ phim Hàn Quốc thuộc thể loại tâm lý, hài hước, giả tưởng do đạo diễn Lee Byeong Heon chỉ đạo. Bộ phim được ..."
"23,5 Độ Nghiêng",https://ohitv.net/phim-bo/235-do-nghieng/,08/03/2024,10,,['Phim Hài'],"Bộ phim “23,5 Độ Nghiêng” kể về một câu chuyện tình yêu đầy cảm xúc và bất ngờ. Nhân vật chính là một nữ sinh nổi tiếng trong trường, ..."
Đừng Rung Động Vì Anh,https://ohitv.net/phim-bo/dung-rung-dong-vi-anh/,01/03/2024,0,,"['Phim Chính Kịch', 'Phim Hài']","“Đừng Rung Động Vì Anh” (2024) kể về Nhạc Thiên Linh, người luôn giấu giếm tình cảm đặc biệt dành cho Cố Tầm, người mà cô luôn ngưỡng ..."
Phi Trì Nhân Sinh,https://ohitv.net/phim-bo/phi-tri-nhan-sinh/,28/02/2024,8,,"['Phim Chính Kịch', 'Phim Hài']","Trong bộ phim “Phi Trì Nhân Sinh” (2024), câu chuyện xoay quanh Trương Trì, một tay đua đường đua nổi tiếng, bị thương nặng sau một ..."
Nữ Hoàng Nước Mắt,https://ohitv.net/phim-bo/nu-hoang-nuoc-mat/,09/03/2024,0,,"['Phim Chính Kịch', 'Phim Hài']","“Một câu chuyện của Baek Hyun Woo và nữ thừa kế Hong Hae In sẽ là một hành trình đầy màu sắc và đầy cảm xúc. Baek Hyun Woo, giám đốc pháp ..."
Hôn Lễ Bất Khả Thi,https://ohitv.net/phim-bo/hon-le-bat-kha-thi/,26/02/2024,0,,"['Phim Chính Kịch', 'Phim Hài']","Câu chuyện về Na Ah Jeong và Do Han hứa hẹn sẽ là một cuộc đấu tranh đầy kịch tính và phức tạp giữa tình yêu và áp lực xã hội, với sự xen lẫn của ..."
Nghịch lý kẻ sát nhân,https://ohitv.net/phim-bo/nghich-ly-ke-sat-nhan/,09/02/2024,7.4,,"['Phim Bí Ẩn', 'Phim Hài', 'Phim Hình Sự']","“Nghịch lý kẻ sát nhân” (2024) là câu chuyện về một chàng trai bình thường bị cuốn vào một vụ giết người vô tình, dẫn đến một loạt ..."
Thám Tử Đáng Yêu,https://ohitv.net/phim-bo/tham-tu-dang-yeu/,03/02/2024,0,,"['Phim Chính Kịch', 'Phim Hài']","Nam Ngư ban đầu là nhân vật chính trong trò chơi Marisu, nhưng cô đã thức dậy và phát hiện mình đang sống trong thời kỳ Cộng hòa và phải chia sẻ ..."
Hỉ Quyển Thường Lạc Thành,https://ohitv.net/phim-bo/hi-quyen-thuong-lac-thanh/,30/01/2024,0,,"['Phim Chính Kịch', 'Phim Hài']","Tạ Toàn Giai đến thành Trường Lạc với mục đích tìm cha, nhưng không ngờ rằng cô sẽ trở thành con gái duy nhất của phú ông Lý Thiên Địa. Tuy ..."
Không Có Cốt Truyện Cũng Không Sao,https://ohitv.net/phim-bo/khong-co-cot-truyen-cung-khong-sao/,28/01/2024,0,,"['Phim Chính Kịch', 'Phim Hài']","Câu chuyện của Zhang Yimeng bắt đầu khi cô tin rằng mình là một công chúa đến từ Vương quốc Tây và đang cố gắng trở lại quá khứ. Tuy nhiên, một ..."
Nốt Trầm Đời Bác SĨ,https://ohitv.net/phim-bo/not-tram-doi-bac-si/,27/01/2024,8.8,,"['Phim Chính Kịch', 'Phim Hài']","Nốt Trầm Đời Bác Sĩ (2024) kể về hai bác sĩ xuất sắc từng là đối thủ ở trường y, nhưng bây giờ tình cờ gặp lại nhau sau nhiều năm. Mỗi người đều ..."
Lâu Rồi Chưa Yêu,https://ohitv.net/phim-bo/lau-roi-chua-yeu/,19/01/2024,7.5,,"['Phim Chính Kịch', 'Phim Hài']","Câu chuyện về Woo-jin và Samuel là một hành trình của sự thay đổi và trưởng thành, từ một mối quan hệ ban đầu chỉ dựa vào dục vọng và khao khát ..."
Hoa Thanh Ca,https://ohitv.net/phim-bo/hoa-thanh-ca/,12/01/2024,6.5,,"['Phim Bí Ẩn', 'Phim Chính Kịch', 'Phim Hài', 'Sci-Fi & Fantasy']","Phim “Hoa Thanh Ca” (2024) kể về Hoa Thanh Ca, một nhà văn nữ, đột ngột xuyên không vào thế giới trong cuốn tiểu thuyết do cô viết. ..."
Hoa Nở Về Đêm,https://ohitv.net/phim-bo/hoa-no-ve-dem/,12/01/2024,8.3,,"['Phim Bí Ẩn', 'Phim Chính Kịch', 'Phim Hài']","“Hoa Nở Về Đêm – Knight Flower” là câu chuyện xoay quanh cuộc sống của Cho Yeo Hwa, một phụ nữ đã trải qua mất mát gia đình và ..."
Lift: Vụ Trộm Trên Không,https://ohitv.net/phim-le/lift-vu-trom-tren-khong/,10/01/2024,5.5,,"['Phim Hài', 'Phim Hành Động', 'Phim Hình Sự']",“Lift: Vụ Trộm Trên Không” (2024) kể về một tay trộm kỳ cựu và một đội ngũ trộm chuyên nghiệp thực hiện phi vụ cuối cùng của họ: đánh ...
Người Phiên Dịch Của Chúng Tôi,https://ohitv.net/phim-bo/nguoi-phien-dich-cua-chung-toi/,08/01/2024,0,,"['Phim Chính Kịch', 'Phim Hài']",“Người Phiên Dịch Của Chúng Tôi” – Our Interpreter (2024) là một tác phẩm điện ảnh đầy xúc cảm do đạo diễn tài năng Trương Đồng ...
Anh Cũng Có Ngày Này,https://ohitv.net/phim-bo/anh-cung-co-ngay-nay/,04/01/2024,0,,"['Phim Chính Kịch', 'Phim Hài']","“Anh Cũng Có Ngày Này” (2024) là một câu chuyện hài hước và đầy ý nghĩa về Tiền Hằng, người sáng lập công ty luật Quân Hằng. Để giải ..."
Nhập Vai,https://ohitv.net/phim-le/nhap-vai/,04/01/2024,5.5,,"['Phim Hài', 'Phim Hành Động', 'Phim Lãng Mạn']","Khi David phát hiện ra bí mật của Emma, thế giới của họ bắt đầu sụp đổ. Emma phải đối mặt với một cuộc lựa chọn khó khăn giữa gia đình và cuộc ..."
Tống Từ Thiều Hoa Lục,https://ohitv.net/phim-bo/tong-tu-thieu-hoa-luc/,26/12/2023,9,,"['Phim Bí Ẩn', 'Phim Chính Kịch', 'Phim Hài']","“Tống Từ Thiều Hoa Lục” (2023) là câu chuyện về sáu thiếu niên do Tống Từ dẫn đầu, tình cờ gặp nhau và cùng nhau phá giải nhiều nghi ..."
Như Hoa Trên Cát,https://ohitv.net/phim-bo/nhu-hoa-tren-cat/,20/12/2023,8.8,,"['Phim Bí Ẩn', 'Phim Chính Kịch', 'Phim Hài']","Một cựu thần đồng đấu vật đang vật lộn trong cuộc hành trình tìm kiếm thành công. Anh suýt bỏ cuộc, mất đi đam mê và niềm tin trong chính mình. ..."
Thiếu Niên Minh Long,https://ohitv.net/phim-bo/thieu-nien-minh-long/,10/12/2023,7.6,,"['Phim Chính Kịch', 'Phim Hài']","“Thiếu Niên Minh Long” (2023) là câu chuyện về Trường THPT Thực Nghiệm Minh Long, một ngôi trường tư thục tại thành phố Tinh Châu, ..."
Những Điều Tồi Tệ,https://ohitv.net/phim-le/nhung-dieu-toi-te/,07/12/2023,8.1, 1080p,"['Phim Hài', 'Phim Khoa Học Viễn Tưởng', 'Phim Lãng Mạn']","Những Điều Tồi Tệ (Poor Things) là một bộ phim do Yorgos Lanthimos đạo diễn và Tony McNamara viết kịch bản, ra mắt vào năm 2023. Phim có sự tham ..."
Tiểu Nương Tử Đương Gia,https://ohitv.net/phim-bo/tieu-nuong-tu-duong-gia/,05/12/2023,8,,"['Phim Hài', 'Sci-Fi & Fantasy']","Tiểu Nương Tử Đương Gia (2023) kể về Trì Nguyệt, một nữ minh tinh bị cuốn vào một sự cố kỳ lạ và xuyên không về thời cổ đại, trở thành góa phụ ..."
Người Yêu Tôi Là Thần Tình Yêu,https://ohitv.net/phim-bo/nguoi-yeu-toi-la-than-tinh-yeu/,01/12/2023,9.1,,"['Phim Chính Kịch', 'Phim Hài']","Người Yêu Tôi Là Thần Tình Yêu – Người Yêu Tôi Là Thần Tình Yêu (2023) Cheon Sang Hyuk là một nàng tiên lôi cuốn, người dễ dàng khiến phụ nữ phải ..."
Không Chỉ Là Thích Em,https://ohitv.net/phim-bo/khong-chi-la-thich-em-i-may-love-you/,25/11/2023,10,,"['Phim Chính Kịch', 'Phim Hài']",“Không Chỉ Là Thích Em” (I May Love You) là một bộ phim có nội dung tình cảm lãng mạn phát sóng vào năm 2023. Câu chuyện xoay quanh ...
Chàng quỷ của tôi,https://ohitv.net/phim-bo/chang-quy-cua-toi/,24/11/2023,8.381,,"['Phim Chính Kịch', 'Phim Hài', 'Sci-Fi & Fantasy']",Một ác quỷ bất ngờ mất đi sức mạnh đáng sợ sau khi bị ràng buộc bởi một nữ thừa kế lạnh lùng. Nhưng có thể cô nữ thừa kế này giữ chìa khóa giúp ...
Diva Của Đảo Hoang – Castaway Diva,https://ohitv.net/phim-bo/diva-cua-dao-hoang-castaway-diva/,28/10/2023,7.9,,"['Phim Chính Kịch', 'Phim Hài']",“Diva Của Đảo Hoang – Castaway Diva” là câu chuyện về một ca sĩ đầy tham vọng đã bị mắc kẹt trên một hòn đảo xa xôi trong suốt ...
Quỷ Lùn Tinh Nghịch 3: Đồng Tâm Hiệp Nhạc,https://ohitv.net/phim-le/quy-lun-tinh-nghich-3-dong-tam-hiep-nhac/,12/10/2023,6, 1080p,"['Phim Chiếu Rạp', 'Phim Gia Đình', 'Phim Giả Tượng', 'Phim Hài', 'Phim Hoạt Hình', 'Phim Nhạc']",“Quỷ Lùn Tinh Nghịch 3: Đồng Tâm Hiệp Nhạc” là phần tiếp theo của loạt phim hoạt hình nổi tiếng “Quỷ Lùn Tinh Nghịch” ...
Mỹ Nhân Đạo Chích,https://ohitv.net/phim-le/my-nhan-dao-chich/,11/10/2023,5.9, 1080p,"['Phim Chính Kịch', 'Phim Hài']","Ji-hye là một kẻ lừa đảo xinh đẹp và thành công một thời, gần đây bắt đầu thất bại với những khuyết điểm của mình và mơ ước thay đổi cuộc sống ..."
Ngày Tuyệt Vời Để Trở Thành Cún,https://ohitv.net/phim-bo/ngay-tuyet-voi-de-tro-thanh-cun/,11/10/2023,8.286,,"['Phim Chính Kịch', 'Phim Hài', 'Sci-Fi & Fantasy']",“Bộ phim “Ngày Tuyệt Vời Để Trở Thành Cún” (A Good Day to be a Dog) là một bộ phim truyền hình Hàn Quốc ra mắt vào năm 2023. ...
Cô Nàng Mạnh Mẽ Gang Nam Soon,https://ohitv.net/phim-bo/co-nang-manh-me-gang-nam-soon/,07/10/2023,7.7,,"['Phim Chính Kịch', 'Phim Hài', 'Phim Hình Sự', 'Sci-Fi & Fantasy']",“Cô Nàng Mạnh Mẽ Gang Nam Soon” là một bộ phim với nội dung xoay quanh câu chuyện của một người phụ nữ trẻ được ban cho sức mạnh siêu ...
Yêu Lại Vợ Ngầu,https://ohitv.net/phim-le/yeu-lai-vo-ngau/,03/10/2023,7, 1080p,"['Phim Chiếu Rạp', 'Phim Hài', 'Phim Lãng Mạn']","Câu chuyện của “Yêu Lại Vợ Ngầu” thật sự hấp dẫn và có những tình tiết độc đáo. Đây là một cốt truyện xoay quanh tình yêu, sự hiểu ..."
Xin Chào Chúng Tôi Là Hoan Hỉ Thiên Đoàn,https://ohitv.net/phim-bo/xin-chao-chung-toi-la-hoan-hi-thien-doan/,22/09/2023,0,,"['Phim Hài', 'Sci-Fi & Fantasy']","“Xin Chào Chúng Tôi Là Hoan Hỉ Thiên Đoàn” là một bộ phim truyền hình với bối cảnh là Nước Hoan Hỉ, nơi diễn ra một cuộc thi tuyển ..."
Hoa Khê Ký,https://ohitv.net/phim-bo/hoa-khe-ky/,16/09/2023,8,,"['Phim Chính Kịch', 'Phim Hài', 'Sci-Fi & Fantasy']","“Hoa Khê Ký” (2023) là một bộ phim cổ trang ngọt ngào kể về cuộc phiêu lưu của Lý Sơ Nguyệt, một cô gái nghịch ngợm từ thời hiện đại, ..."
Lương Tâm Kẻ Bắt Cóc,https://ohitv.net/phim-bo/luong-tam-ke-bat-coc/,13/09/2023,8.5,,"['Phim Bí Ẩn', 'Phim Chính Kịch', 'Phim Hài', 'Phim Hình Sự']","“Lương Tâm Kẻ Bắt Cóc” là một câu chuyện đầy kịch tính về cuộc đời đầy bi kịch của Kim Myung-Joon (Yoon Kye-Sang), một người đàn ông ..."
Kiệu Hoa Hỉ Sự,https://ohitv.net/phim-bo/kieu-hoa-hi-su-wrong-carriage-right-groom/,28/08/2023,6,,"['Phim Chính Kịch', 'Phim Hài']",“Tân Lên Nhầm Kiệu Hoa Được Chồng Như Ý” là một câu chuyện đầy hấp dẫn về sự đổi đời bất ngờ của một cô gái bình thường khi cô bị ...
Tình Yêu Này Bất Khả Kháng,https://ohitv.net/phim-bo/tinh-yeu-nay-bat-kha-khang/,23/08/2023,8,,"['Phim Chính Kịch', 'Phim Hài', 'Sci-Fi & Fantasy']","“Tình Yêu Này Bất Khả Kháng” là một câu chuyện tình yêu đầy bí ẩn và đầy cảm động, xoay quanh cuộc gặp gỡ định mệnh giữa một luật sư ..."
Bàn Tay Ma Thuật,https://ohitv.net/phim-bo/ban-tay-ma-thuat/,12/08/2023,7.9,,"['Phim Bí Ẩn', 'Phim Chính Kịch', 'Phim Hài', 'Sci-Fi & Fantasy']",“Bàn Tay Ma Thuật” là một câu chuyện kinh dị và hồi hộp xoay quanh cuộc hợp tác giữa một bác sĩ thú y có khả năng ngoại cảm và một ...
Công Tử Mặc Thượng Hương,https://ohitv.net/phim-bo/cong-tu-mac-thuong-huong/,01/08/2023,0,,"['Phim Chính Kịch', 'Phim Hài']","“Công Tử Mặc Thượng Hương” (2023) kể về Đồng Tử Phù, một họa sĩ vẽ tay, vô tình bị cuốn vào tác phẩm truyện tranh của mình và gặp gỡ ..."
Đừng Nói Dối Em,https://ohitv.net/phim-bo/dung-noi-doi-em/,31/07/2023,7.8,,"['Phim Bí Ẩn', 'Phim Chính Kịch', 'Phim Hài', 'Sci-Fi & Fantasy']","“Đừng Nói Dối Em” là một câu chuyện đầy mê hoặc xoay quanh Mok Sol Hee, một người phụ nữ sở hữu khả năng siêu nhiên đặc biệt: cô có ..."
